{
  "$schema": "https://arky.foundation/schemas/testing/fixture-tim-v1.json",
  "id": "valid-tim-001",
  "description": "Valid basic TIM for temperature sensor reading",
  "tim": {
    "time": {
      "ts": "2025-10-15T12:00:00Z"
    },
    "identity": {
      "id": "did:key:z6MkiTBz1ymuepAQ4HEHYSF1H8quG5GLVVQR3djdX3mDooWp"
    },
    "measurement": {
      "name": "temperature",
      "value": 22.5,
      "unit": "urn:arky:unit:temp.C",
      "method": {
        "type": "sensor",
        "source": "device:temp-sensor-01",
        "version": "v1"
      },
      "device": "urn:arky:device:temp-sensor-01",
      "error": "0.1"
    },
    "cid": "zQmYwAPJzv5CZsnANOTaWbHXpUjdEFRCQWFk8QwuTKYvM3Z",
    "sig": "eyJhbGciOiJFZERTQSIsInR5cCI6IkpXUyIsImtpZCI6InRlc3Qta2V5LTIwMjUtMDEifQ.eyJ0aW1lIjp7InRzIjoiMjAyNS0xMC0xNVQxMjowMDowMFoifSwiaWRlbnRpdHkiOnsiaWQiOiJkaWQ6a2V5Ono2TWtpVEJ6MXltdWVwQVE0SEVIWVNGMUg4cXVHNUdMVlZRUjNkakRYM21Eb29XcCJ9LCJtZWFzdXJlbWVudCI6eyJuYW1lIjoidGVtcGVyYXR1cmUiLCJ2YWx1ZSI6MjIuNSwidW5pdCI6InVybjphcmt5OnVuaXQ6dGVtcC5DIiwibWV0aG9kIjp7InR5cGUiOiJzZW5zb3IiLCJzb3VyY2UiOiJkZXZpY2U6dGVtcC1zZW5zb3ItMDEiLCJ2ZXJzaW9uIjoidjEifSwiZGV2aWNlIjoidXJuOmFya3k6ZGV2aWNlOnRlbXAtc2Vuc29yLTAxIiwiZXJyb3IiOiIwLjEifX0.MOCK_SIGNATURE_FOR_TESTING"
  },
  "canonical_bytes_hex": "7b226964656e74697479223a7b226964223a226469643a6b65793a7a364d6b695442",
  "signing_key_ref": "fixtures/keys/ed25519-test-01.json",
  "created": "2025-10-15T00:00:00Z"
}
